### ISSUE TITLE
EKS: ping between weave interfaces not working with calico CNI

### ISSUE THREAD

**Issue by brdji** [testground/testground#1455]
Issue - ping between weave interfaces not working on the calico cluster; ARP resolution works, ICMP doesn't
```
14:31:40.708550 ARP, Request who-has ip-10-37-4-7.eu-west-3.compute.internal tell ip-10-37-4-3.eu-west-3.compute.internal, length 28
14:31:40.708567 ARP, Request who-has ip-10-37-4-7.eu-west-3.compute.internal tell ip-10-37-4-3.eu-west-3.compute.internal, length 28
14:31:40.708630 ARP, Reply ip-10-37-4-7.eu-west-3.compute.internal is-at 76:be:8e:0e:cf:41 (oui Unknown), length 28
14:31:40.708634 IP ip-10-37-4-3.eu-west-3.compute.internal > ip-10-37-4-7.eu-west-3.compute.internal: ICMP echo request, id 10, seq 1, length 64
14:31:41.740168 IP ip-10-37-4-3.eu-west-3.compute.internal > ip-10-37-4-7.eu-west-3.compute.internal: ICMP echo request, id 10, seq 2, length 64
14:31:42.768231 IP ip-10-37-4-3.eu-west-3.compute.internal > ip-10-37-4-7.eu-west-3.compute.internal: ICMP echo request, id 10, seq 3,
```

Solution:
```sudo iptables -D FORWARD -o weave -j DROP;```
 note: executed via a configmap + daemonset on each worker node

How to test the solution is working - successfully pinging other pods via IP addresses assigned by weave

_Originally posted by @brdji in https://github.com/testground/testground/issues/1435#issuecomment-1240888700_
