### ISSUE TITLE
Knowledge gathered - Sprint 12

### ISSUE THREAD

**Issue by KatarinaKeti** [testground/testground#1435]

**Comment by brdji** [comment]
I will list all the various issues we have encountered over the past several sprints, as well as the solutions here.

**Comment by brdji** [comment]
```
Jul 21 12:39:51.465194  WARN    not enough resources on cluster {"runner": "cluster:k8s", "run_id": "cbcki52si6eh1i8fnu90", "available_cpus": -0.4, "needed_cpus": 0.2, "utilisation": 0.85}
```
It would appear that this CPU resources check does not work as expected in the EKS cluster. For now, we have simply skipped it - by commenting out the code in `pkg/runner/cluster_k8s.go`, line 1017.

**Comment by brdji** [comment]
Issue - testground (storm) tests failing with more than 40 instances; sync-service showed an OOMkilled error

Solution - increase limits for the sync service from 20cpu/20MB ram to 120

**Comment by brdji** [comment]
Issue - testground (storm) tests failing with more than 40 instances; errors encountered:
```
websocket closed unexpectedly: failed to read JSON message: failed to get reader: failed to read frame header: EOF

Jul 27 15:42:09.737143  FATAL   error while reading socket      {"error": "failed to read JSON message: failed to get reader: failed to read frame header: EOF"}
```
Solution - increase limits for the testground daemon and sidecar

**Comment by brdji** [comment]
Issue - ping between weave interfaces not working on the calico cluster; ARP resolution works, ICMP doesn't
```
14:31:40.708550 ARP, Request who-has ip-10-37-4-7.eu-west-3.compute.internal tell ip-10-37-4-3.eu-west-3.compute.internal, length 28
14:31:40.708567 ARP, Request who-has ip-10-37-4-7.eu-west-3.compute.internal tell ip-10-37-4-3.eu-west-3.compute.internal, length 28
14:31:40.708630 ARP, Reply ip-10-37-4-7.eu-west-3.compute.internal is-at 76:be:8e:0e:cf:41 (oui Unknown), length 28
14:31:40.708634 IP ip-10-37-4-3.eu-west-3.compute.internal > ip-10-37-4-7.eu-west-3.compute.internal: ICMP echo request, id 10, seq 1, length 64
14:31:41.740168 IP ip-10-37-4-3.eu-west-3.compute.internal > ip-10-37-4-7.eu-west-3.compute.internal: ICMP echo request, id 10, seq 2, length 64
14:31:42.768231 IP ip-10-37-4-3.eu-west-3.compute.internal > ip-10-37-4-7.eu-west-3.compute.internal: ICMP echo request, id 10, seq 3,
```

Solution - sudo iptables -D FORWARD -o weave -j DROP; note: executed via a configmap + daemonset on each worker node

How to test the solution is working - successfully pinging other pods via IP addresses assigned by weave

**Comment by brdji** [comment]
Issue - ping between weave interfaces not working on the aws vpc cni cluster; ARP resolution works, ICMP doesn't

Solution:
```
sudo iptables -t nat -I POSTROUTING 2 -m comment --comment "AWS SNAT CHAIN" ! -o weave -j AWS-SNAT-CHAIN-0
sudo iptables -t nat -D POSTROUTING -m comment --comment "AWS SNAT CHAIN" -j AWS-SNAT-CHAIN-0
```
Note: executed via a configmap + daemonset on each worker node

How to test the solution is working - successfully pinging other pods via IP addresses assigned by weave

**Comment by brdji** [comment]
Issue - multus suddenly unable to start, with the following error message:
```
"Error: failed to start container "generate-kubeconfig": Error response from daemon: OCI runtime create failed: container_linux.go:380: starting container process caused: exec: "/usr/src/multus-cni/bin/generate-kubeconfig": stat /usr/src/multus-cni/bin/generate-kubeconfig: no such file or directory: unknown"
```
Solution - multus code updated upstream, so we had to change the image our deployments are pulling

**Comment by brdji** [comment]
Issue - multus and weave 'fighting' over eth0; happening because multus writes the weave config inside 00-multus.conf, instead of the primary CNI config. Errors look like this:
```
  Normal   AddedInterface          9s                  multus             Add eth0 [10.47.0.2/12] from weave
  Normal   AddedInterface          7s                  multus             Add eth0 [10.47.0.2/12] from weave
  Normal   AddedInterface          6s                  multus             Add eth0 [10.47.0.2/12] from weave
  Normal   AddedInterface          5s                  multus             Add eth0 [10.47.0.2/12] from weave
  Normal   AddedInterface          4s                  multus             Add eth0 [10.47.0.2/12] from weave
  Normal   AddedInterface          3s                  multus             Add eth0 [10.47.0.2/12] from weave
  Normal   AddedInterface          2s                  multus             Add eth0 [10.47.0.2/12] from weave
  Normal   AddedInterface          1s                  multus             Add eth0 [10.47.0.2/12] from weave
```
and:
```
could not create veth pair vethwepl7524981-vethwepg7524981: file exists
```

Solution - initially solved by restarting the `kube-multus-ds` in `-n kube-system`, but later introduced a custom configmap and editing the multus daemonset `("cniVersion": "0.3.1")` so it always includes the primary CNI config (calico or AWS VPC CNI)

How to test the solution is working- scaling the nodegroups and scheduling pods/running tests

**Comment by brdji** [comment]
Issue - tests and pings not working due to coredns receiving IP address from weave instead of the primary CNI (related to the previous one)

Solution - kubectl rollout restart deploy coredns -n kube-system, but later fixed with introducing the configmap for multus; some errors received while troubleshooting:

```
W0810 16:35:23.080721       1 reflector.go:441] k8s.io/client-go/informers/factory.go:134: watch of *v1.EndpointSlice ended with: an error on the server ("unable to decode an event from the watch stream: http2: client connection lost") has prevented the request from succeeding

failed to initialize sidecar: failed to WebSocket dial: failed to send handshake request: Get "http://testground-sync-service:5050": dial tcp: i/o timeout

websocket closed unexpectedly: failed to read JSON message: failed to get reader: failed to read frame header: EOF

Jul 27 15:42:09.737143  FATAL   error while reading socket      {"error": "failed to read JSON message: failed to get reader: failed to read frame header: EOF"}
```

How to test the solution is working - verifying that ping between pods and tests are working without issues

**Comment by brdji** [comment]
Issue - sidecar unable to be scheduled
```
May 27 16:21:46.984924  ERROR  sidecar worker failed: failed to initialise the container: failed to get handle to network namespace: failed to set into network namespace 19 while creating netlink socket: operation not permitted  {"host": "unix:///var/run/docker.sock", "container": "b510d89b2c66dc8a18472be548170657d28114cc8eeb3d368d266a2787c68007"}
```
Solution - Adding the following in the pods config:
```
securityContext:
          capabilities:
            add: ["NET_ADMIN","NET_RAW"]
```
How to test the solution is working  - successfully scheduling sidecar

**Comment by galargh** [comment]
Would it make sense to create a GitHub issue per issue listed here? It would be easier to start discussions about them.

**Comment by brdji** [comment]
I guess it would be useful to create a separate issue for each one I listed here, add the solution in the comment, open it for discussion, and then close each one if nobody raises an objection. 
It would simplify future EKS / k8s development, making it easier to search for an issue/solution.
